# decode-dimms version 4.3

Memory Serial Presence Detect Decoder
By Philip Edelbrock, Christian Zuckschwerdt, Burkart Lingner,
Jean Delvare, Trent Piepho and others


Decoding EEPROM: /sys/bus/i2c/drivers/at24/0-0051
Guessing DIMM is in                              bank 2
Kernel driver used                               at24

---=== SPD EEPROM Information ===---
EEPROM CRC of bytes 0-116                        OK (0x86F7)
# of bytes written to SDRAM EEPROM               176
Total number of bytes in EEPROM                  256
Fundamental Memory type                          DDR3 SDRAM
SPD Revision                                     1.2
Module Type                                      UDIMM

---=== Memory Characteristics ===---
Maximum module speed                             1600 MT/s (PC3-12800)
Size                                             4096 MB
Banks x Rows x Columns x Bits                    8 x 16 x 10 x 64
Ranks                                            1
SDRAM Device Width                               8 bits
Primary Bus Width                                64 bits
tCL-tRCD-tRP-tRAS                                11-11-11-28
Supported CAS Latencies (tCL)                    11T, 10T, 9T, 8T, 7T, 6T

---=== Timings at Standard Speeds ===---
tCL-tRCD-tRP-tRAS as DDR3-1600                   11-11-11-28
tCL-tRCD-tRP-tRAS as DDR3-1333                   9-9-9-24
tCL-tRCD-tRP-tRAS as DDR3-1066                   7-7-7-19
tCL-tRCD-tRP-tRAS as DDR3-800                    6-6-6-14

---=== Timing Parameters ===---
Minimum Cycle Time (tCK)                         1.250 ns
Minimum CAS Latency Time (tAA)                   13.125 ns
Minimum Write Recovery time (tWR)                15.000 ns
Minimum RAS# to CAS# Delay (tRCD)                13.125 ns
Minimum Row Active to Row Active Delay (tRRD)    6.000 ns
Minimum Row Precharge Delay (tRP)                13.125 ns
Minimum Active to Precharge Delay (tRAS)         35.000 ns
Minimum Active to Auto-Refresh Delay (tRC)       48.125 ns
Minimum Recovery Delay (tRFC)                    260.000 ns
Minimum Write to Read CMD Delay (tWTR)           7.500 ns
Minimum Read to Pre-charge CMD Delay (tRTP)      7.500 ns
Minimum Four Activate Window Delay (tFAW)        30.000 ns

---=== Optional Features ===---
Operable voltages                                1.5V
RZQ/6 supported?                                 Yes
RZQ/7 supported?                                 Yes
DLL-Off Mode supported?                          Yes
Operating temperature range                      0-95 degrees C
Refresh Rate in extended temp range              2X
Auto Self-Refresh?                               No
On-Die Thermal Sensor readout?                   No
Partial Array Self-Refresh?                      No
Module Thermal Sensor                            No
SDRAM Device Type                                Standard Monolithic
Maximum Activate Count (MAC)                     Untested

---=== Physical Characteristics ===---
Module Height                                    30 mm
Module Thickness                                 2 mm front, 2 mm back
Module Width                                     133.35 mm
Module Reference Card                            A revision 1
Rank 1 Mapping                                   Mirrored

---=== Manufacturer Data ===---
Module Manufacturer                              SK Hynix (former Hyundai Electronics)
DRAM Manufacturer                                SK Hynix (former Hyundai Electronics)
Manufacturing Location Code                      0x01
Manufacturing Date                               2014-W11
Assembly Serial Number                           0x0053CDAA
Part Number                                      HMT451U6AFR8C-PB
Revision Code                                    0x4E30


Number of SDRAM DIMMs detected and decoded: 1

Number of rows per bank = 2^16
Number of columns per row = 2^10
row size = 64 * 2^10 bits = 8KB
No ecc since total and data width are the same (64 each)

X, Y => conflict
X, A => row buffer hit
Y, A => conflict

X: 1000001000101110 1 110 100000 0 000000
A: 1000001000101110 1 111 100000 0 000000
Y: 1000001000101111 1 100 100000 0 000000

$ sudo ./bin/reverse
X: 4368224256, Y: 4368338944
A: 4368232448
A: 2763972608
A: 291610624
A: 168312832
A: 2471305216

X: 1000100001101101 110 1100000 0 000000
Y: 1000101101110110 101 1000000 0 000000
A: 1000100011110111 001 1100000 0 000000

Y: 100001100111101001000000000000000
A: 100001100011111001001000000000000
X: 100001100101101100111000000000000

X: 100010101100110001101000000000000
Y: 100010101100110001111000000000000

X: 100001101001100110100000000000000
Y: 100001000110001011100000000000000